id,audio_file,text,contest_type,sample_type,wpm,condition,duration
4658,morse_004658.wav,AG3R 599 WV,ARRLDX,exchange,33,dx_expedition,5.756875
3588,morse_003588.wav,CQ CQ CQ DE GW2JWV GW2JWV GW2JWV,NAQP,cq,35,contest_moderate,15.488125
3591,morse_003591.wav,CQ CQ CQ DE VE7KVT VE7KVT VE7KVT,CQWW,cq,31,dx_expedition,14.9108125
716,morse_000716.wav,JI8OW 599 25,IARU,exchange,39,contest_poor,5.7601875
2022,morse_002022.wav,F8XO 599 89,IARU,exchange,33,dx_expedition,6.7130625
4039,morse_004039.wav,NN8M 579 ?,CQWPX,partial,35,contest_good,5.1733125
3563,morse_003563.wav,CQ TEST CQ TEST DE JE1LA JE1LA K JE1LA DE WA2TI 599 VA K NR? NR? JE1LA DE WA2TI 599 VA K 599 KW GL QSL TU TEST WA2TI,ARRLDX,qso,24,dx_expedition,68.3161875
2586,morse_002586.wav,DL6EOT 2B ?,FIELD_DAY,partial,17,contest_moderate,10.0578125
3514,morse_003514.wav,TEST GJ4EL GJ4EL TEST,IARU,cq,32,clean,8.5289375
1763,morse_001763.wav,JA5LJ 599 3T024,CQWPX,exchange,18,contest_poor,15.07925
3332,morse_003332.wav,GW8GRY 599 64,IARU,exchange,31,clean,7.7255
2096,morse_002096.wav,TEST JF4JK JF4JK TEST JF4JK KC8U 3C WNY R 3A NNY TU QSL TU FIELD_DAY KC8U,FIELD_DAY,qso,25,dx_expedition,41.528375
2742,morse_002742.wav,TEST RX8SXD RX8SXD TEST RX8SXD DE WI3KX 599 22 K 599 16 GL 73 GL WI3KX TEST,CQWW,qso,32,contest_moderate,34.7786875
2714,morse_002714.wav,TEST DM0JP DM0JP TEST DM0JP 559 19 DC4KGV 599 81 GL 73 GL DC4KGV TEST,IARU,qso,39,clean,27.6193125
4400,morse_004400.wav,CQ TEST CQ TEST DE RT4DPP RT4DPP K RT4DPP 599 58 NT4XW 599 43 GL 73 GL NT4XW TEST,IARU,qso,33,contest_good,35.561375
4081,morse_004081.wav,CQ CQ CQ DE JO1FK JO1FK JO1FK JO1FK 214 B 86 QC JO8NQ CALL? JO1FK 214 B 86 QC JO8NQ 3T474 B 32 PAC GL TU QRZ? JO8NQ,SWEEPSTAKES,qso,29,contest_poor,67.83575
2942,morse_002942.wav,M08W1 2A VI,FIELD_DAY,exchange,28,contest_good,7.16325
1436,morse_001436.wav,CQ CQ CQ DE AG1JQA AG1JQA AG1JQA,SWEEPSTAKES,cq,20,clean,26.326875
2275,morse_002275.wav,UH8O9 3T272 ?,SWEEPSTAKES,partial,36,contest_moderate,6.5605
2706,morse_002706.wav,CQ TEST CQ TEST DE DM0ES DM0ES K DM0ES 5464 B 80 VI RZ0QE TU 9642 B 53 ID DM0ES QSL TU TEST RZ0QE,SWEEPSTAKES,qso,16,contest_moderate,86.2864375
3279,morse_003279.wav,RO5XEM 6T669 B 99 WV,SWEEPSTAKES,exchange,18,contest_moderate,18.2563125
4733,morse_004733.wav,WE?,IARU,partial,27,contest_moderate,2.0751875
3931,morse_003931.wav,NN4ZS 599 41,IARU,exchange,37,clean,5.804625
612,morse_000612.wav,CQ CQ CQ DE JL0BMQ JL0BMQ JL0BMQ JL0BMQ 599 19 M52RRG R 589 29 TU 73 GL M52RRG TEST,CQWW,qso,15,contest_good,91.5354375
1245,morse_001245.wav,CQ TEST CQ TEST DE JA7VK JA7VK K,ARRLDX,cq,15,clean,29.108375
3773,morse_003773.wav,TEST NW9VCT NW9VCT TEST,CQWW,cq,27,contest_good,10.86925
3568,morse_003568.wav,TEST VE7WQ VE7WQ TEST,IARU,cq,24,clean,11.2135
4870,morse_004870.wav,UG7OZ 599 ?,IARU,partial,23,contest_good,8.745
3178,morse_003178.wav,CQ CQ CQ DE LO7QJJ LO7QJJ LO7QJJ LO7QJJ DE RA7N1 7673 MARY SC K RA? RA? LO7QJJ DE RA7N1 7673 MARY SC K 7417 PAT TN GL 73 GL RA7N1 TEST,SPRINT,qso,29,contest_moderate,73.05025
2861,morse_002861.wav,CQ TEST CQ TEST DE NR7N NR7N K NR7N DE LV1VGY 2A OR K TU 4A ENY NR7N TU QRZ? LV1VGY,FIELD_DAY,qso,21,contest_poor,55.45425
4654,morse_004654.wav,VO5L7 2970 STEVE MN,SPRINT,exchange,38,contest_good,8.046875
2290,morse_002290.wav,TEST JQ9XXX JQ9XXX TEST JQ9XXX DE RG2SEJ 599 18 K TU 599 31 JQ9XXX QSL TU TEST RG2SEJ,CQWW,qso,40,contest_moderate,33.078125
3262,morse_003262.wav,JM0QHN T698 ?,SPRINT,partial,18,dx_expedition,12.4625
1971,morse_001971.wav,CQ TEST CQ TEST DE ZV3UY ZV3UY K ZV3UY WL3HNB 599 ME WL3HN? WL3HN? ZV3UY WL3HNB 599 ME R 599 KW TU QSL TU TEST WL3HNB,ARRLDX,qso,22,dx_expedition,78.0428125
1874,morse_001874.wav,CQ CQ CQ DE VO1UZ VO1UZ VO1UZ VO1UZ DE JO3MU 599 1500 K TU 599 1500 VO1UZ QSL TU ARRLDX JO3MU,ARRLDX,qso,28,contest_poor,55.25675
622,morse_000622.wav,TEST UE5TE UE5TE TEST,SPRINT,cq,15,contest_moderate,13.061125
2845,morse_002845.wav,CQ CQ CQ DE VA2OQ VA2OQ VA2OQ VA2OQ DE DO1AA 599 37 K TU 599 79 VA2OQ QSL TU TEST DO1AA,IARU,qso,40,clean,34.8175625
2223,morse_002223.wav,CQ CQ CQ DE EH8EV EH8EV EH8EV EH8EV DE PU5YQF 599 100 K 599 100 GL 73 GL PU5YQF TEST,ARRLDX,qso,20,clean,65.3374375
3327,morse_003327.wav,VK0OQ 599 ?,ARRLDX,partial,35,contest_good,6.2111875
4511,morse_004511.wav,DC2?,CQWPX,partial,27,clean,3.29
4010,morse_004010.wav,DF6QU 599 ?,ARRLDX,partial,16,contest_good,12.2026875
4177,morse_004177.wav,CQ CQ CQ DE EA2S2 EA2S2 EA2S2 EA2S2 DE IZ8AU 599 5 K R 599 100 TU QSL TU TEST IZ8AU,ARRLDX,qso,29,contest_poor,42.687
1153,morse_001153.wav,DB8?,SPRINT,partial,39,contest_good,2.215
2144,morse_002144.wav,CQ TEST CQ TEST DE IW4MH IW4MH K IW4MH FRANK CO VO2KH8 QRZ? DE IW4MH IW4MH FRANK CO VO2KH8 LIZ NH GL 73 GL VO2KH8 TEST,NAQP,qso,15,contest_poor,110.617875
451,morse_000451.wav,CQ CQ CQ DE PV0GKE PV0GKE PV0GKE,IARU,cq,38,dx_expedition,13.56275
892,morse_000892.wav,CQ CQ CQ DE JM8GHR JM8GHR JM8GHR JM8GHR DE IU8UU 2A TN K R 5C NFL TU TU QRZ? IU8UU,FIELD_DAY,qso,22,dx_expedition,55.6200625
3477,morse_003477.wav,VY0WI7 7812 ?,SWEEPSTAKES,partial,28,clean,9.0715625
1571,morse_001571.wav,TEST ND3O ND3O TEST ND3O F3GQ 5665 ED GA R 6551 AL MD TU TU QRZ? F3GQ,SPRINT,qso,39,contest_good,25.49525
4840,morse_004840.wav,TEST EG6GVS EG6GVS TEST EG6GVS 9707 A 32 NH DF3XP DF? DF? EG6GVS 9707 A 32 NH DF3XP TU T297 A 22 QC EG6GVS TU QRZ? DF3XP,SWEEPSTAKES,qso,20,contest_poor,89.7339375
4230,morse_004230.wav,TEST JC2NBN JC2NBN TEST JC2NBN 1B AR JG3FZA 3B MT GL QSL TU TEST JG3FZA,FIELD_DAY,qso,34,contest_poor,29.4626875
1218,morse_001218.wav,CQ TEST CQ TEST DE NN2TT NN2TT K NN2TT 599 41 VK8KA QRZ? DE NN2TT NN2TT 599 41 VK8KA 599 46 GL 73 GL VK8KA TEST,IARU,qso,39,contest_poor,41.496
950,morse_000950.wav,TEST WB8F WB8F TEST WB8F JD6IPC 599 1500 TU 599 IA WB8F 73 GL JD6IPC TEST,ARRLDX,qso,40,contest_moderate,27.7028125
4744,morse_004744.wav,CQ CQ CQ DE M04GT M04GT M04GT,IARU,cq,39,contest_good,12.25125
114,morse_000114.wav,CQ CQ CQ DE VA8GQ VA8GQ VA8GQ VA8GQ DE DC5TYT 5D BC K 5A TN GL TU QRZ? DC5TYT,FIELD_DAY,qso,23,contest_moderate,50.2799375
2931,morse_002931.wav,CQ TEST CQ TEST DE JH6AP1 JH6AP1 K,NAQP,cq,20,dx_expedition,24.1293125
1,morse_000001.wav,TEST GJ7UZK GJ7UZK TEST,NAQP,cq,26,dx_expedition,12.1639375
717,morse_000717.wav,CQ CQ CQ DE IW7LD IW7LD IW7LD IW7LD DE ED1ASC T606 B 75 KY K 6907 B 67 NH GL 73 GL ED1ASC TEST,SWEEPSTAKES,qso,16,contest_poor,87.3504375
3336,morse_003336.wav,TEST RL7JV RL7JV TEST RL7JV WG9K 8166 Q 75 WY 3602 B 27 VA GL TU QRZ? WG9K,SWEEPSTAKES,qso,19,clean,61.632125
1373,morse_001373.wav,JF1OQ4 599 ?,CQWPX,partial,34,contest_good,7.066
1290,morse_001290.wav,CQ CQWW CQ CQWW DE EA7LMV EA7LMV K EA7LMV 579 35 LV6UMT TU 599 2 EA7LMV TU QRZ? LV6UMT,CQWW,qso,39,contest_poor,32.7840625
2969,morse_002969.wav,CQ SPRINT CQ SPRINT DE M16DS M16DS K M16DS DE DE5SI 4491 DAN KS K QRZ? DE M16DS M16DS DE DE5SI 4491 DAN KS K R 7T060 BILL TX TU 73 GL DE5SI TEST,SPRINT,qso,26,contest_moderate,78.0130625
3379,morse_003379.wav,CQ TEST CQ TEST DE K7GAO K7GAO K K7GAO 599 MN WC0XDX 599 NE GL TU QRZ? WC0XDX,ARRLDX,qso,26,contest_poor,44.6943125
407,morse_000407.wav,M3KA5 599 1500,ARRLDX,exchange,40,dx_expedition,7.225375
4518,morse_004518.wav,CQ TEST CQ TEST DE KR5ZAR KR5ZAR K,IARU,cq,38,contest_good,11.7269375
1635,morse_001635.wav,TEST VK0WB VK0WB TEST,FIELD_DAY,cq,19,dx_expedition,14.6315
3792,morse_003792.wav,VK6IA 3138 M 11 SJV,SWEEPSTAKES,exchange,22,contest_poor,15.03875
2561,morse_002561.wav,CQ TEST CQ TEST DE UC9AN UC9AN K UC9AN DE JI3GZ 6B SJV K UC9AN AGN UC9AN DE JI3GZ 6B SJV K TU 1A NNY UC9AN 73 GL JI3GZ TEST,FIELD_DAY,qso,31,contest_moderate,56.6680625
2913,morse_002913.wav,CQ CQ CQ DE RI5YCH RI5YCH RI5YCH,NAQP,cq,26,contest_poor,18.4004375
3517,morse_003517.wav,WU0RW 6247 A 49 IL,SWEEPSTAKES,exchange,15,contest_good,20.0555
285,morse_000285.wav,TEST AC1ON AC1ON TEST,ARRLDX,cq,23,dx_expedition,11.9320625
4280,morse_004280.wav,ED8VCJ 7T895 MIKE WI,SPRINT,exchange,33,contest_poor,9.1559375
2189,morse_002189.wav,KD1KW?,ARRLDX,partial,33,clean,3.3329375
2772,morse_002772.wav,CQ CQ CQ DE JR4B6 JR4B6 JR4B6 JR4B6 DE RK0ZRM 599 36 K NR? NR? JR4B6 DE RK0ZRM 599 36 K R 599 6 TU TU QRZ? RK0ZRM,CQWW,qso,15,clean,120.32325
4234,morse_004234.wav,TEST JF1OBV JF1OBV TEST JF1OBV 943 B 81 SB NE6X 2928 A 49 SB GL QSL TU SWEEPSTAKES NE6X,SWEEPSTAKES,qso,24,clean,53.4940625
3724,morse_003724.wav,EG6JKE 8T837 B 52 MAR,SWEEPSTAKES,exchange,29,clean,11.3315625
1137,morse_001137.wav,TEST NL6CAB NL6CAB TEST NL6CAB DE IZ5RR 599 5 K 599 VT GL TU QRZ? IZ5RR,ARRLDX,qso,33,contest_good,30.6971875
3392,morse_003392.wav,CQ TEST CQ TEST DE VY1KYU VY1KYU K VY1KYU DE M19VGT ANN HI K CALL? VY1KYU DE M19VGT ANN HI K R GEORGE FL TU 73 GL M19VGT TEST,NAQP,qso,22,contest_good,81.68
3499,morse_003499.wav,DF2AVU 599 ?,IARU,partial,30,dx_expedition,7.1856875
3297,morse_003297.wav,CQ CQ CQ DE JM8NRA JM8NRA JM8NRA JM8NRA DE NS5LQ 599 UT K TU 559 1500 JM8NRA 73 GL NS5LQ TEST,ARRLDX,qso,30,contest_moderate,46.6174375
535,morse_000535.wav,IZ0CHI 3B ?,FIELD_DAY,partial,26,contest_good,7.4599375
1575,morse_001575.wav,VO0YSJ 599 39,IARU,exchange,35,contest_moderate,7.7328125
3096,morse_003096.wav,CQ CQ CQ DE JR5CAM JR5CAM JR5CAM,NAQP,cq,39,contest_moderate,12.7495625
1398,morse_001398.wav,DR2CD 599 ?,IARU,partial,29,dx_expedition,7.27425
2326,morse_002326.wav,TEST JF2HYK JF2HYK TEST,CQWPX,cq,28,contest_poor,11.07275
2720,morse_002720.wav,CQ TEST CQ TEST DE M57HI M57HI K,SWEEPSTAKES,cq,22,contest_moderate,18.56675
663,morse_000663.wav,RF9RF 1A ?,FIELD_DAY,partial,38,contest_good,4.92325
1560,morse_001560.wav,NL?,FIELD_DAY,partial,16,contest_moderate,3.480375
4146,morse_004146.wav,F4SLO 599 4,CQWW,exchange,25,clean,7.8485
2262,morse_002262.wav,CQ CQ CQ DE PT2QA PT2QA PT2QA PT2QA EC4WHR 599 12 TU 599 37 PT2QA QSL TU TEST EC4WHR,IARU,qso,31,contest_poor,41.5305625
1947,morse_001947.wav,TEST DQ7DTY DQ7DTY TEST,SPRINT,cq,26,clean,11.35
2029,morse_002029.wav,TEST I8RWC I8RWC TEST,CQWPX,cq,15,clean,17.4104375
4783,morse_004783.wav,CQ TEST CQ TEST DE DM7DFG DM7DFG K DM7DFG EC9BUP 1A SV TU 7A ENY DM7DFG TU QRZ? EC9BUP,FIELD_DAY,qso,18,clean,66.8958125
2498,morse_002498.wav,DC7DTX 8109 BOB DE,SPRINT,exchange,20,contest_moderate,15.1906875
833,morse_000833.wav,TEST I1BHD I1BHD TEST,ARRLDX,cq,16,contest_good,15.9104375
1047,morse_001047.wav,TEST F3JI F3JI TEST,CQWW,cq,36,contest_moderate,6.9069375
1193,morse_001193.wav,CQ CQWW CQ CQWW DE JF8JB JF8JB K JF8JB 599 13 M18CJI R 599 18 TU TU QRZ? M18CJI,CQWW,qso,25,dx_expedition,53.817875
1030,morse_001030.wav,CQ CQ CQ DE WA0HU2 WA0HU2 WA0HU2,IARU,cq,24,dx_expedition,21.840625
1055,morse_001055.wav,CQ TEST CQ TEST DE DR4HKC DR4HKC K,SWEEPSTAKES,cq,35,contest_poor,13.1280625
3046,morse_003046.wav,JG1GBW 5A ?,FIELD_DAY,partial,34,contest_good,5.5829375
3504,morse_003504.wav,TEST DK6GDF DK6GDF TEST,ARRLDX,cq,35,contest_moderate,8.40125
1525,morse_001525.wav,DJ7VU 599 6,CQWW,exchange,35,contest_poor,6.1455
2502,morse_002502.wav,CQ TEST CQ TEST DE JN1OF JN1OF K,SWEEPSTAKES,cq,27,contest_moderate,17.2861875
3567,morse_003567.wav,CQ FIELD_DAY CQ FIELD_DAY DE DJ7WKG DJ7WKG K DJ7WKG WL4OIY 2A EWA 1A GA GL 73 GL WL4OIY TEST,FIELD_DAY,qso,34,dx_expedition,39.0066875
4797,morse_004797.wav,TEST WI0APM WI0APM TEST WI0APM DE ED8NI JACK ID K R BILL KS TU QSL TU NAQP ED8NI,NAQP,qso,24,dx_expedition,44.07475
3655,morse_003655.wav,TEST JP0EA JP0EA TEST,SWEEPSTAKES,cq,39,contest_poor,7.1948125
4763,morse_004763.wav,GW3R1 9177 ?,SPRINT,partial,38,contest_good,6.349875
771,morse_000771.wav,CQ CQ CQ DE RC3IT RC3IT RC3IT RC3IT DE VE3TG 1101 SUE PA K VE3? VE3? RC3IT DE VE3TG 1101 SUE PA K TU 7T115 JACK PA RC3IT 73 GL VE3TG TEST,SPRINT,qso,23,dx_expedition,86.4983125
2504,morse_002504.wav,CQ CQ CQ DE JN7IK JN7IK JN7IK JN7IK DE M1BL7 LARRY IL K TU SAM AL JN7IK QSL TU NAQP M1BL7,NAQP,qso,25,contest_good,52.00025
872,morse_000872.wav,CQ TEST CQ TEST DE NZ7KX6 NZ7KX6 K,NAQP,cq,20,contest_moderate,23.845375
4784,morse_004784.wav,WQ?,SPRINT,partial,29,dx_expedition,2.513875
1557,morse_001557.wav,TEST DK9HL DK9HL TEST,ARRLDX,cq,40,contest_good,7.001
467,morse_000467.wav,TEST DA3ONR DA3ONR TEST,ARRLDX,cq,23,contest_poor,11.8888125
4311,morse_004311.wav,TEST IQ1OF IQ1OF TEST IQ1OF DE RO8XYW GEORGE RI K R KEN CT TU QSL TU TEST RO8XYW,NAQP,qso,17,contest_moderate,63.9281875
2076,morse_002076.wav,DR8JPV DAN CA,NAQP,exchange,24,dx_expedition,8.430625
4478,morse_004478.wav,JG6TI 599 24,CQWW,exchange,15,dx_expedition,13.7138125
1266,morse_001266.wav,VK3DU 634 A 35 EWA,SWEEPSTAKES,exchange,22,contest_poor,12.71975
1726,morse_001726.wav,EB1S?,SWEEPSTAKES,partial,26,dx_expedition,3.076875
1930,morse_001930.wav,KD5B MARY IA,NAQP,exchange,22,dx_expedition,7.60225
4243,morse_004243.wav,GU4UHF 599 20,CQWW,exchange,36,contest_moderate,6.6668125
2811,morse_002811.wav,CQ TEST CQ TEST DE JS7GGN JS7GGN K JS7GGN DE M59XH 599 KW K TU 599 1500 JS7GGN 73 GL M59XH TEST,ARRLDX,qso,34,contest_moderate,42.298
2682,morse_002682.wav,CQ CQ CQ DE KB9UD KB9UD KB9UD,ARRLDX,cq,25,dx_expedition,18.583375
4069,morse_004069.wav,CQ SWEEPSTAKES CQ SWEEPSTAKES DE JN8UTY JN8UTY K JN8UTY DE RB9FQ7 6T153 A 64 SV K TU 9T968 A 83 SD JN8UTY QSL TU SWEEPSTAKES RB9FQ7,SWEEPSTAKES,qso,18,dx_expedition,101.777125
2142,morse_002142.wav,CQ ARRLDX CQ ARRLDX DE GI1BBO GI1BBO K GI1BBO IK4US 599 KW QRZ? DE GI1BBO GI1BBO IK4US 599 KW 599 KW GL QSL TU TEST IK4US,ARRLDX,qso,28,contest_poor,64.252625
217,morse_000217.wav,CQ TEST CQ TEST DE DD7HT5 DD7HT5 K DD7HT5 AY6VE DAVE FL R MARY GA TU QSL TU NAQP AY6VE,NAQP,qso,25,clean,45.972
3367,morse_003367.wav,IU3Y3 ART MA,NAQP,exchange,39,contest_moderate,4.6889375
376,morse_000376.wav,TEST EC7F4 EC7F4 TEST EC7F4 DE DR5QSX JACK NH K TU PAT VA EC7F4 73 GL DR5QSX TEST,NAQP,qso,23,contest_moderate,47.577375
3171,morse_003171.wav,CQ CQ CQ DE EA2GX EA2GX EA2GX EA2GX KY9JA 599 69 R 599 40 TU TU QRZ? KY9JA,IARU,qso,17,contest_moderate,69.8978125
794,morse_000794.wav,KE1U 599 2058,CQWPX,exchange,15,contest_poor,15.8359375
1127,morse_001127.wav,TEST I9CI I9CI TEST,NAQP,cq,17,contest_moderate,13.280625
1156,morse_001156.wav,VK3DPQU 3F AR,FIELD_DAY,exchange,26,clean,7.8859375
201,morse_000201.wav,CQ TEST CQ TEST DE LO6FE LO6FE K LO6FE VK4BXJV 599 7405 599 5530 GL TU QRZ? VK4BXJV,CQWPX,qso,34,contest_poor,37.71225
3063,morse_003063.wav,TEST VK2FW VK2FW TEST VK2FW LO8CM 599 32 CALL? VK2FW LO8CM 599 32 TU 599 3 VK2FW TU QRZ? LO8CM,IARU,qso,31,contest_moderate,48.599125
1090,morse_001090.wav,CQ TEST CQ TEST DE NF2KKU NF2KKU K,FIELD_DAY,cq,38,clean,12.4894375
2900,morse_002900.wav,EG2EH?,NAQP,partial,20,contest_good,4.6638125
2676,morse_002676.wav,PW0ZIU 1D ND,FIELD_DAY,exchange,25,contest_moderate,7.6643125
3806,morse_003806.wav,AC9J 4D EB,FIELD_DAY,exchange,33,contest_poor,5.22475
1027,morse_001027.wav,CQ CQ CQ DE GM3JQ GM3JQ GM3JQ,IARU,cq,39,dx_expedition,12.717125
1331,morse_001331.wav,F6CU 7802 JIM IL,SPRINT,exchange,29,contest_poor,9.479
4535,morse_004535.wav,CQ CQ CQ DE IQ7COK IQ7COK IQ7COK,FIELD_DAY,cq,36,dx_expedition,14.2314375
594,morse_000594.wav,CQ CQ CQ DE IQ4SD4 IQ4SD4 IQ4SD4 IQ4SD4 599 LA WC5B TU 599 1500 IQ4SD4 73 GL WC5B TEST,ARRLDX,qso,20,dx_expedition,65.8546875
4926,morse_004926.wav,DN?,NAQP,partial,29,contest_poor,2.1180625
343,morse_000343.wav,TEST RH4UQ RH4UQ TEST,CQWPX,cq,33,contest_poor,7.814875
2439,morse_002439.wav,TEST JG8EO JG8EO TEST JG8EO I6DSE 6971 JACK WV I6? I6? JG8EO I6DSE 6971 JACK WV R 3T035 KEN AK TU QSL TU TEST I6DSE,SPRINT,qso,35,contest_good,46.88475
1926,morse_001926.wav,GI2OO 599 KW,ARRLDX,exchange,35,dx_expedition,6.25675
4580,morse_004580.wav,CQ IARU CQ IARU DE N5GC2 N5GC2 K N5GC2 AE9ESG 559 52 R 599 59 TU QSL TU TEST AE9ESG,IARU,qso,25,dx_expedition,47.5704375
1577,morse_001577.wav,CQ CQ CQ DE VO9NKH VO9NKH VO9NKH VO9NKH VA2SIU 599 100 R 599 KW TU QSL TU TEST VA2SIU,ARRLDX,qso,27,dx_expedition,48.4115
4175,morse_004175.wav,NL5VXL 599 16,CQWW,exchange,36,contest_moderate,6.844125
1815,morse_001815.wav,GI5?,NAQP,partial,35,clean,2.2380625
3971,morse_003971.wav,CQ CQ CQ DE DM2JX DM2JX DM2JX DM2JX TOM MN DP2KOM TOM VA GL 73 GL DP2KOM TEST,NAQP,qso,16,contest_moderate,73.2931875
267,morse_000267.wav,ED1VZO 599 ?,IARU,partial,17,contest_good,12.751375
496,morse_000496.wav,CQ CQ CQ DE JH2MU JH2MU JH2MU JH2MU DE DO2ZG 6696 B 83 ORG K QRZ? DE JH2MU JH2MU DE DO2ZG 6696 B 83 ORG K 7609 Q 12 VA GL QSL TU TEST DO2ZG,SWEEPSTAKES,qso,37,clean,59.830125
17,morse_000017.wav,KU6DQ?,CQWPX,partial,31,clean,3.302
3736,morse_003736.wav,KC1?,FIELD_DAY,partial,26,dx_expedition,3.598875
4030,morse_004030.wav,VA?,SPRINT,partial,35,clean,2.139
2380,morse_002380.wav,EA7EBU 599 18,IARU,exchange,26,dx_expedition,8.504125
2818,morse_002818.wav,CQ CQ CQ DE JF6OY JF6OY JF6OY JF6OY DO8VE 599 21 QRZ? DE JF6OY JF6OY DO8VE 599 21 599 16 GL 73 GL DO8VE TEST,IARU,qso,31,contest_poor,58.3023125
3668,morse_003668.wav,JJ6IPV 4A LAX,FIELD_DAY,exchange,28,contest_poor,7.40975
2460,morse_002460.wav,KP3ZGH 599 ?,CQWW,partial,30,contest_moderate,7.1798125
1046,morse_001046.wav,WJ6H GARY ?,NAQP,partial,35,contest_moderate,5.47075
3859,morse_003859.wav,TEST WT7SLX WT7SLX TEST WT7SLX VK2MRR1 599 1500 R 599 PA TU TU QRZ? VK2MRR1,ARRLDX,qso,33,contest_poor,34.3031875
1814,morse_001814.wav,DR0I7 RAY OH,NAQP,exchange,29,contest_poor,6.9004375
4006,morse_004006.wav,CQ IARU CQ IARU DE PP0QAX PP0QAX K PP0QAX DE AD9H 599 48 K TU 599 18 PP0QAX QSL TU TEST AD9H,IARU,qso,38,dx_expedition,37.7111875
231,morse_000231.wav,CQ CQ CQ DE IW7R1 IW7R1 IW7R1 IW7R1 DE JJ4LLF 9620 B 31 STX K R 9T300 B 72 ME TU TU QRZ? JJ4LLF,SWEEPSTAKES,qso,32,contest_moderate,48.162875
1370,morse_001370.wav,KQ1CGO 599 4125,CQWPX,exchange,20,dx_expedition,14.5371875
4319,morse_004319.wav,CQ CQ CQ DE JJ7DB JJ7DB JJ7DB JJ7DB DE JH1VAH 3903 ED MD K R 9T754 JOHN OR TU TU QRZ? JH1VAH,SPRINT,qso,16,contest_good,90.307125
2821,morse_002821.wav,TEST JF2LJQ JF2LJQ TEST JF2LJQ VY9SFJ 9069 B 49 WMA R 9835 B 68 KY TU QSL TU TEST VY9SFJ,SWEEPSTAKES,qso,24,contest_poor,58.080625
2990,morse_002990.wav,TEST VK4XH VK4XH TEST,FIELD_DAY,cq,26,clean,10.2958125
650,morse_000650.wav,CQ CQ CQ DE WT6WQI WT6WQI WT6WQI WT6WQI DM0WD 8507 BEN SD 4T439 AL KY GL TU QRZ? DM0WD,SPRINT,qso,40,contest_good,32.717375
52,morse_000052.wav,CQ TEST CQ TEST DE DQ2NPS DQ2NPS K DQ2NPS DE NY3F 599 2597 K TU 599 7518 DQ2NPS TU QRZ? NY3F,CQWPX,qso,28,contest_poor,50.5014375
2807,morse_002807.wav,IQ8PS 599 9,CQWW,exchange,24,contest_good,8.6274375
849,morse_000849.wav,CQ CQ CQ DE JF2IPH JF2IPH JF2IPH JF2IPH IQ8CL PAT AZ QRZ? DE JF2IPH JF2IPH IQ8CL PAT AZ TU SAM WY JF2IPH 73 GL IQ8CL TEST,NAQP,qso,36,contest_good,50.723375
312,morse_000312.wav,NO6F?,ARRLDX,partial,19,clean,4.6431875
131,morse_000131.wav,TEST EG1AIQ EG1AIQ TEST EG1AIQ DE F3ML 5A WY K QRZ? DE EG1AIQ EG1AIQ DE F3ML 5A WY K 2D MI GL QSL TU FIELD_DAY F3ML,FIELD_DAY,qso,15,clean,104.2914375
4282,morse_004282.wav,CQ CQ CQ DE 2E6TER 2E6TER 2E6TER 2E6TER 599 22 VK1Y3 TU 599 14 2E6TER QSL TU TEST VK1Y3,IARU,qso,24,contest_moderate,53.2468125
412,morse_000412.wav,CQ CQ CQ DE JS4YIX JS4YIX JS4YIX JS4YIX JC8IX 599 17 R 599 21 TU QSL TU TEST JC8IX,CQWW,qso,34,contest_poor,38.2045625
4265,morse_004265.wav,TEST WX1EGZ WX1EGZ TEST,FIELD_DAY,cq,26,dx_expedition,11.72075
1108,morse_001108.wav,CQ SPRINT CQ SPRINT DE IK2LE IK2LE K IK2LE DE VK2TE 8193 SUE NV K R 2002 TOM WY TU TU QRZ? VK2TE,SPRINT,qso,17,contest_good,80.6444375
4663,morse_004663.wav,CQ CQWPX CQ CQWPX DE AA4YYM AA4YYM K AA4YYM DE JO3DY 599 3T596 K TU 599 2912 AA4YYM 73 GL JO3DY TEST,CQWPX,qso,33,contest_good,48.736
2708,morse_002708.wav,TEST IW3DZ IW3DZ TEST,CQWW,cq,23,contest_good,11.1259375
205,morse_000205.wav,NY?,NAQP,partial,36,contest_moderate,1.8414375
537,morse_000537.wav,WX9P 599 3701,CQWPX,exchange,34,dx_expedition,8.06275
2087,morse_002087.wav,TEST M8QHS M8QHS TEST M8QHS JD5VAI 8115 ART RI TU 4735 BOB NE M8QHS QSL TU TEST JD5VAI,SPRINT,qso,18,dx_expedition,65.207
4881,morse_004881.wav,JH?,ARRLDX,partial,33,contest_moderate,2.2896875
1799,morse_001799.wav,CQ TEST CQ TEST DE DP2IC DP2IC K,FIELD_DAY,cq,24,contest_poor,18.448625
446,morse_000446.wav,AD6MK RICK CO,NAQP,exchange,37,contest_moderate,5.5053125
290,morse_000290.wav,JN5?,SPRINT,partial,20,clean,3.8045
4252,morse_004252.wav,DO3F?,IARU,partial,24,contest_moderate,3.76
1139,morse_001139.wav,NG6Y?,SWEEPSTAKES,partial,37,contest_moderate,2.354875
1415,morse_001415.wav,CQ TEST CQ TEST DE JM3JYN JM3JYN K,NAQP,cq,40,dx_expedition,11.9546875
3497,morse_003497.wav,CQ CQ CQ DE DN3XD DN3XD DN3XD DN3XD DE EF3QT 5396 GEORGE IN K 3466 BILL PA GL QSL TU TEST EF3QT,SPRINT,qso,24,clean,56.54175
2844,morse_002844.wav,F8MH 2A ?,FIELD_DAY,partial,40,contest_good,4.3716875
4270,morse_004270.wav,TEST DB8GCO DB8GCO TEST,FIELD_DAY,cq,26,contest_poor,12.1149375
3243,morse_003243.wav,TEST IK6BSE IK6BSE TEST IK6BSE JC3LE 599 1500 R 599 KW TU 73 GL JC3LE TEST,ARRLDX,qso,20,clean,51.9686875
81,morse_000081.wav,DB5DNW 2943 ?,SPRINT,partial,27,contest_good,8.548375
2485,morse_002485.wav,F2YL 3A ?,FIELD_DAY,partial,23,contest_good,7.1829375
4461,morse_004461.wav,TEST WG6I WG6I TEST WG6I WA3I 599 1031 NR? NR? WG6I WA3I 599 1031 599 3T079 GL TU QRZ? WA3I,CQWPX,qso,34,clean,42.1705625
2348,morse_002348.wav,VK2MVK 599 4T675,CQWPX,exchange,26,clean,10.4319375
4236,morse_004236.wav,VE9SX 9219 ?,SPRINT,partial,36,dx_expedition,6.4498125
198,morse_000198.wav,CQ CQ CQ DE NQ6VAG NQ6VAG NQ6VAG NQ6VAG VE8KJ 599 435 TU 599 9023 NQ6VAG QSL TU TEST VE8KJ,CQWPX,qso,25,contest_moderate,55.320375
2750,morse_002750.wav,VK1YBN 599 ?,CQWPX,partial,21,contest_moderate,10.614
2741,morse_002741.wav,JM3IKY 599 ?,IARU,partial,15,contest_moderate,14.178125
4942,morse_004942.wav,CQ CQ CQ DE KC2X KC2X KC2X KC2X JH5VLK 599 7742 599 4T025 GL TU QRZ? JH5VLK,CQWPX,qso,29,contest_moderate,43.96375
2041,morse_002041.wav,TEST NF6SYF NF6SYF TEST NF6SYF 7255 JOHN WV DJ1MMG R 1524 SAM ME TU 73 GL DJ1MMG TEST,SPRINT,qso,39,contest_good,31.2554375
3311,morse_003311.wav,NQ8KIH 559 ?,CQWPX,partial,36,contest_moderate,5.9348125
993,morse_000993.wav,CQ TEST CQ TEST DE WE4MMR WE4MMR K WE4MMR 559 33 RD8HSV R 599 13 TU TU QRZ? RD8HSV,CQWW,qso,23,dx_expedition,50.75425
1165,morse_001165.wav,JH1ZO 599 2368,CQWPX,exchange,26,contest_poor,10.500625
3966,morse_003966.wav,TEST GW2KX GW2KX TEST GW2KX 8T221 B 72 OH ZX5WX R 6T874 M 99 CO TU TU QRZ? ZX5WX,SWEEPSTAKES,qso,25,contest_moderate,49.442
3249,morse_003249.wav,NG?,CQWPX,partial,32,contest_good,1.7670625
2425,morse_002425.wav,CQ CQWPX CQ CQWPX DE DC6XTD DC6XTD K DC6XTD DE N3SEB 599 T029 K NR? NR? DC6XTD DE N3SEB 599 T029 K 599 4204 GL 73 GL N3SEB TEST,CQWPX,qso,24,contest_moderate,81.2813125
1845,morse_001845.wav,TEST WE0IC WE0IC TEST,ARRLDX,cq,19,contest_poor,13.5115
2180,morse_002180.wav,CQ TEST CQ TEST DE JK8MO JK8MO K,FIELD_DAY,cq,31,contest_poor,15.016625
133,morse_000133.wav,CQ CQ CQ DE JF5BAO JF5BAO JF5BAO,CQWPX,cq,36,contest_poor,14.2385625
3790,morse_003790.wav,JG3HL3 599 19,CQWW,exchange,15,clean,16.36475
2358,morse_002358.wav,TEST KD4I KD4I TEST,IARU,cq,38,clean,6.1678125
3892,morse_003892.wav,DF9LBI 599 ?,ARRLDX,partial,34,dx_expedition,6.489
3865,morse_003865.wav,AY2PQ FRANK KY,NAQP,exchange,21,clean,10.8311875
3059,morse_003059.wav,VO1UKE 1B SB,FIELD_DAY,exchange,22,contest_poor,9.0120625
2493,morse_002493.wav,WZ4L 3A IA,FIELD_DAY,exchange,35,contest_moderate,4.3403125
516,morse_000516.wav,CQ CQ CQ DE JB2VOP JB2VOP JB2VOP JB2VOP AY6RGI 2A SK 6A UT GL 73 GL AY6RGI TEST,FIELD_DAY,qso,40,contest_moderate,30.6429375
1026,morse_001026.wav,WO6CTJ 8296 ?,SPRINT,partial,16,dx_expedition,14.9434375
2571,morse_002571.wav,CQ TEST CQ TEST DE JP6JYA JP6JYA K,SPRINT,cq,38,contest_moderate,13.18325
3277,morse_003277.wav,CQ TEST CQ TEST DE DO7JF DO7JF K DO7JF 3C MO DR6RF DR? DR? DO7JF 3C MO DR6RF R 2C NNY TU QSL TU TEST DR6RF,FIELD_DAY,qso,24,contest_good,64.215375
2596,morse_002596.wav,TEST NW4GS9 NW4GS9 TEST,NAQP,cq,34,clean,8.848875
3405,morse_003405.wav,IK0RBY 5443 DAVE NH,SPRINT,exchange,40,dx_expedition,7.476375
994,morse_000994.wav,GM2UJ 5001 PAUL NC,SPRINT,exchange,16,clean,18.9026875
3634,morse_003634.wav,CQ CQ CQ DE DF0IU DF0IU DF0IU DF0IU JI2BS 8T095 B 17 WY R 257 A 10 ON TU TU QRZ? JI2BS,SWEEPSTAKES,qso,34,clean,40.218375
2948,morse_002948.wav,JD6DG0 6T587 DICK MI,SPRINT,exchange,23,contest_moderate,13.4195
2788,morse_002788.wav,NS9WF?,IARU,partial,32,clean,3.2721875
4328,morse_004328.wav,CQ TEST CQ TEST DE M4ZNT M4ZNT K M4ZNT GM7JOX 4459 LYNN OK R 1691 KEN PA TU TU QRZ? GM7JOX,SPRINT,qso,30,contest_poor,43.6629375
1511,morse_001511.wav,TEST WB7IPG WB7IPG TEST WB7IPG VK4RA 599 1 NR? NR? WB7IPG VK4RA 599 1 599 18 GL TU QRZ? VK4RA,CQWW,qso,34,contest_poor,41.6329375
4672,morse_004672.wav,VO4?,FIELD_DAY,partial,38,contest_poor,2.483
1110,morse_001110.wav,IU1S?,ARRLDX,partial,16,clean,5.1746875
3506,morse_003506.wav,VE5HB 579 51,IARU,exchange,34,contest_moderate,6.350625
1309,morse_001309.wav,EA?,SWEEPSTAKES,partial,17,contest_good,2.6263125
2090,morse_002090.wav,KV2PVP 5834 A 98 MAR,SWEEPSTAKES,exchange,21,clean,15.55975
3794,morse_003794.wav,TEST IQ9UVM IQ9UVM TEST,SPRINT,cq,33,clean,8.9523125
4308,morse_004308.wav,GJ5FWU 559 33,IARU,exchange,39,contest_moderate,6.102875
1036,morse_001036.wav,DA7YK 3T971 JACK RI,SPRINT,exchange,19,contest_poor,16.0246875
675,morse_000675.wav,GM6WQ 599 ?,CQWPX,partial,25,dx_expedition,8.4804375
4245,morse_004245.wav,IK9PCN 2A NV,FIELD_DAY,exchange,15,contest_poor,12.3989375
1166,morse_001166.wav,CQ CQ CQ DE F0EG F0EG F0EG,CQWW,cq,36,clean,11.5016875
1668,morse_001668.wav,WA2RTC 1A ?,FIELD_DAY,partial,31,contest_good,5.9455625
3474,morse_003474.wav,CQ TEST CQ TEST DE UB5IB UB5IB K UB5IB DE NB6DSZ 599 2T613 K R 599 140 TU TU QRZ? NB6DSZ,CQWPX,qso,31,contest_good,41.4308125
1067,morse_001067.wav,CQ TEST CQ TEST DE JN8CJ JN8CJ K JN8CJ 579 KW DB7PPT TU 599 KW JN8CJ 73 GL DB7PPT TEST,ARRLDX,qso,16,contest_good,81.048625
1469,morse_001469.wav,CQ CQ CQ DE JK8JLQ JK8JLQ JK8JLQ JK8JLQ 599 54 KW3Z JK8JLQ AGN JK8JLQ 599 54 KW3Z TU 599 68 JK8JLQ QSL TU IARU KW3Z,IARU,qso,18,contest_good,106.7994375
