id,audio_file,text,contest_type,sample_type,wpm,condition,duration
1122,morse_001122.wav,CQ CQ CQ DE G5EGA G5EGA G5EGA G5EGA 599 76 EA3FAA CALL? G5EGA 599 76 EA3FAA TU 599 28 G5EGA 73 GL EA3FAA TEST,IARU,qso,19,contest_good,82.410125
962,morse_000962.wav,TEST M02SJX M02SJX TEST M02SJX VE5UZF 3A NLI CALL? M02SJX VE5UZF 3A NLI 2A QC GL 73 GL VE5UZF TEST,FIELD_DAY,qso,29,contest_poor,49.3791875
3627,morse_003627.wav,GM4YB 4A ?,FIELD_DAY,partial,29,contest_poor,5.8611875
4636,morse_004636.wav,CQ TEST CQ TEST DE RB3KO RB3KO K,SPRINT,cq,31,contest_moderate,14.8265625
4638,morse_004638.wav,CQ CQ CQ DE KJ0GKG KJ0GKG KJ0GKG,SWEEPSTAKES,cq,38,contest_moderate,14.4935
276,morse_000276.wav,CQ TEST CQ TEST DE PY2UDL PY2UDL K PY2UDL 599 8 VE4RJ 599 45 GL TU QRZ? VE4RJ,IARU,qso,15,clean,78.4923125
1922,morse_001922.wav,PY1PM 599 65,IARU,exchange,22,contest_poor,10.6099375
4305,morse_004305.wav,CQ CQ CQ DE DE1JVU DE1JVU DE1JVU,ARRLDX,cq,38,contest_moderate,13.0100625
3012,morse_003012.wav,JL1?,IARU,partial,30,clean,3.0939375
1890,morse_001890.wav,RR3DYL 3T398 GARY OR,SPRINT,exchange,27,contest_moderate,11.90775
3933,morse_003933.wav,AC4BTW 4B ?,FIELD_DAY,partial,21,contest_good,8.296625
4333,morse_004333.wav,CQ TEST CQ TEST DE JK9PWQ JK9PWQ K JK9PWQ RAY ID EH5OS NR? NR? JK9PWQ RAY ID EH5OS ANN MS GL TU QRZ? EH5OS,NAQP,qso,18,clean,85.02325
4375,morse_004375.wav,TEST NO5TE NO5TE TEST,CQWW,cq,17,dx_expedition,13.2908125
4563,morse_004563.wav,TEST IZ8TO IZ8TO TEST IZ8TO JOHN DC DK7UJJ TU LEE WI IZ8TO TU QRZ? DK7UJJ,NAQP,qso,30,contest_poor,34.2909375
4738,morse_004738.wav,VA8Z?,ARRLDX,partial,38,contest_poor,2.690375
1969,morse_001969.wav,TEST DK9M1 DK9M1 TEST DK9M1 JO8KOV 867 B 05 NNY TU 147 A 02 ME DK9M1 TU QRZ? JO8KOV,SWEEPSTAKES,qso,29,contest_good,45.777375
4338,morse_004338.wav,CQ TEST CQ TEST DE F4ZII F4ZII K F4ZII IW1IE 1090 GEORGE CT IW1I? IW1I? F4ZII IW1IE 1090 GEORGE CT R 6923 JACK MN TU 73 GL IW1IE TEST,SPRINT,qso,19,contest_poor,99.369125
1280,morse_001280.wav,CQ CQ CQ DE JD9LHQ JD9LHQ JD9LHQ,SWEEPSTAKES,cq,22,contest_moderate,24.6146875
817,morse_000817.wav,DF0FL 599 5,CQWW,exchange,35,contest_poor,5.884125
3345,morse_003345.wav,WL9IS 2D SNJ,FIELD_DAY,exchange,33,contest_good,6.0195
4831,morse_004831.wav,CQ TEST CQ TEST DE IU4TC IU4TC K,ARRLDX,cq,19,contest_moderate,21.7165
3011,morse_003011.wav,CQ CQ CQ DE VK4PF VK4PF VK4PF VK4PF M37TS 599 4636 CALL? VK4PF M37TS 599 4636 599 8947 GL QSL TU TEST M37TS,CQWPX,qso,34,contest_poor,49.94
2423,morse_002423.wav,JD8MAS 599 ?,CQWW,partial,30,dx_expedition,7.210375
4565,morse_004565.wav,CQ TEST CQ TEST DE JR9QZ0 JR9QZ0 K,CQWPX,cq,25,clean,21.26825
4485,morse_004485.wav,CQ TEST CQ TEST DE EE2BUN EE2BUN K,SPRINT,cq,26,contest_poor,16.0929375
1612,morse_001612.wav,TEST UI1IC UI1IC TEST,CQWPX,cq,30,dx_expedition,8.77775
2705,morse_002705.wav,JO3?,FIELD_DAY,partial,32,clean,3.044
552,morse_000552.wav,TEST JJ1LD JJ1LD TEST JJ1LD DE RP0FM 599 5T379 K TU 599 9758 JJ1LD TU QRZ? RP0FM,CQWPX,qso,40,contest_moderate,32.0870625
3385,morse_003385.wav,CQ CQ CQ DE NA1T5 NA1T5 NA1T5 NA1T5 VO3KKB ART DE NA1T5 AGN NA1T5 VO3KKB ART DE SUE NE GL 73 GL VO3KKB TEST,NAQP,qso,37,clean,40.117125
2043,morse_002043.wav,AD0B 130 BEN MS,SPRINT,exchange,27,contest_good,8.951
1091,morse_001091.wav,IU7PVL RICK ?,NAQP,partial,37,dx_expedition,5.9590625
992,morse_000992.wav,CQ CQ CQ DE VK6LHHJ VK6LHHJ VK6LHHJ VK6LHHJ DK6RDE 599 201 TU 599 3686 VK6LHHJ QSL TU TEST DK6RDE,CQWPX,qso,37,contest_poor,39.748
4044,morse_004044.wav,CQ TEST CQ TEST DE JD0GV JD0GV K,SPRINT,cq,33,contest_moderate,14.000125
2656,morse_002656.wav,CQ CQ CQ DE DA7SU DA7SU DA7SU,NAQP,cq,24,contest_good,17.91775
3657,morse_003657.wav,CQ CQ CQ DE KR8LFZ KR8LFZ KR8LFZ KR8LFZ JD9SC 589 15 TU 599 19 KR8LFZ QSL TU CQWW JD9SC,CQWW,qso,34,clean,41.9975
92,morse_000092.wav,W2OMX 2A MS,FIELD_DAY,exchange,28,contest_poor,6.8053125
3596,morse_003596.wav,TEST RY1NL RY1NL TEST RY1NL SAM IL VE9HV VE9H? VE9H? RY1NL SAM IL VE9HV RICK SC GL TU QRZ? VE9HV,NAQP,qso,16,dx_expedition,85.1799375
1709,morse_001709.wav,TEST WK6M5 WK6M5 TEST WK6M5 DE WT7ZET 4T424 B 68 NE K TU 5T146 A 56 WMA WK6M5 73 GL WT7ZET TEST,SWEEPSTAKES,qso,34,contest_moderate,37.9858125
3135,morse_003135.wav,CQ CQ CQ DE DH2K5 DH2K5 DH2K5,SWEEPSTAKES,cq,25,contest_moderate,18.506625
162,morse_000162.wav,CQ TEST CQ TEST DE UC3GM UC3GM K UC3GM WJ2QUG 569 T457 UC3GM AGN UC3GM WJ2QUG 569 T457 R 599 1705 TU QSL TU TEST WJ2QUG,CQWPX,qso,15,contest_good,119.205
246,morse_000246.wav,TEST EA7YQ EA7YQ TEST,FIELD_DAY,cq,16,clean,16.344875
4746,morse_004746.wav,CQ TEST CQ TEST DE KF0NLK KF0NLK K KF0NLK DE9LLZ RAY NM DE9LL? DE9LL? KF0NLK DE9LLZ RAY NM R RON MA TU TU QRZ? DE9LLZ,NAQP,qso,36,contest_poor,47.03325
209,morse_000209.wav,CQ CQ CQ DE LS4GL3 LS4GL3 LS4GL3,ARRLDX,cq,23,contest_good,21.81575
3179,morse_003179.wav,CQ TEST CQ TEST DE IK8BO IK8BO K,SPRINT,cq,15,contest_good,29.0728125
3822,morse_003822.wav,CQ SPRINT CQ SPRINT DE JJ6IF JJ6IF K JJ6IF 8364 JANE DE EF2MHW TU 8845 GEORGE MN JJ6IF 73 GL EF2MHW TEST,SPRINT,qso,39,contest_poor,37.7050625
3907,morse_003907.wav,CQ CQ CQ DE AC5F AC5F AC5F AC5F PU1IPG 599 1500 TU 589 WI AC5F 73 GL PU1IPG TEST,ARRLDX,qso,32,contest_good,38.9056875
4480,morse_004480.wav,CQ TEST CQ TEST DE PU4T4 PU4T4 K,SPRINT,cq,27,contest_moderate,15.9933125
2015,morse_002015.wav,CQ ARRLDX CQ ARRLDX DE NN0HBL NN0HBL K NN0HBL DE PX8EDA 599 100 K NR? NR? NN0HBL DE PX8EDA 599 100 K TU 599 MS NN0HBL TU QRZ? PX8EDA,ARRLDX,qso,30,dx_expedition,67.684
1631,morse_001631.wav,CQ CQ CQ DE 2E1VWX 2E1VWX 2E1VWX 2E1VWX 397 B 71 STX EB5GQT R 4T444 B 91 MI TU QSL TU TEST EB5GQT,SWEEPSTAKES,qso,15,contest_moderate,97.412625
2234,morse_002234.wav,LV5AU 315 LARRY NH,SPRINT,exchange,19,contest_good,14.0825
902,morse_000902.wav,CQ CQ CQ DE IQ1UYG IQ1UYG IQ1UYG IQ1UYG DE DG2MS 599 23 K 599 3 GL QSL TU TEST DG2MS,CQWW,qso,19,dx_expedition,69.3145625
2627,morse_002627.wav,CQ CQ CQ DE PP6BCV PP6BCV PP6BCV PP6BCV EH7BU JOHN MI TU LIZ CA PP6BCV QSL TU TEST EH7BU,NAQP,qso,39,dx_expedition,33.1620625
3201,morse_003201.wav,DD2MC T296 Q 57 NH,SWEEPSTAKES,exchange,23,contest_good,13.0551875
3123,morse_003123.wav,M59?,ARRLDX,partial,25,dx_expedition,3.2165625
1546,morse_001546.wav,TEST RV0LCP RV0LCP TEST,CQWPX,cq,26,clean,12.3848125
310,morse_000310.wav,CQ CQ CQ DE EB3XW EB3XW EB3XW,NAQP,cq,39,contest_good,11.8716875
1674,morse_001674.wav,TEST GI7GP GI7GP TEST,CQWW,cq,17,dx_expedition,15.3590625
1529,morse_001529.wav,TEST KA9R KA9R TEST KA9R DE UC4DRY 599 20 K QRZ? DE KA9R KA9R DE UC4DRY 599 20 K 599 25 GL TU QRZ? UC4DRY,CQWW,qso,20,contest_good,80.9175625
2997,morse_002997.wav,NC4L JANE FL,NAQP,exchange,17,contest_good,10.3003125
1870,morse_001870.wav,CQ CQ CQ DE IU3NCB IU3NCB IU3NCB,FIELD_DAY,cq,30,contest_good,15.92925
1646,morse_001646.wav,IU5QM?,SWEEPSTAKES,partial,22,contest_good,4.083875
1592,morse_001592.wav,DJ8KEI 988 ?,SWEEPSTAKES,partial,28,clean,7.8923125
5,morse_000005.wav,GM5HSY JOHN PA,NAQP,exchange,39,clean,5.83125
3049,morse_003049.wav,CQ CQ CQ DE GJ9YH GJ9YH GJ9YH GJ9YH 599 6T570 PS0PNN TU 599 3389 GJ9YH QSL TU TEST PS0PNN,CQWPX,qso,17,contest_moderate,85.949
322,morse_000322.wav,CQ TEST CQ TEST DE RC0DIU RC0DIU K,SWEEPSTAKES,cq,38,dx_expedition,12.5126875
4476,morse_004476.wav,TEST VE1MI VE1MI TEST,CQWW,cq,20,dx_expedition,12.1789375
1374,morse_001374.wav,GD9HS?,CQWPX,partial,37,clean,3.19925
1119,morse_001119.wav,TEST IU5GN9 IU5GN9 TEST,SPRINT,cq,21,clean,13.02275
1112,morse_001112.wav,F0OPA 6949 ?,SPRINT,partial,32,contest_good,7.293
515,morse_000515.wav,EF3WOD JACK CA,NAQP,exchange,38,dx_expedition,5.9661875
4290,morse_004290.wav,CQ CQ CQ DE DB3RXJ DB3RXJ DB3RXJ DB3RXJ DE IU7WU6 599 60 K DB3RXJ AGN DB3RXJ DE IU7WU6 599 60 K R 599 46 TU QSL TU TEST IU7WU6,IARU,qso,15,contest_poor,129.1986875
4486,morse_004486.wav,TEST JJ1KIJ JJ1KIJ TEST JJ1KIJ 589 611 JQ8NJF TU 599 271 JJ1KIJ QSL TU TEST JQ8NJF,CQWPX,qso,15,contest_moderate,86.966625
3585,morse_003585.wav,CQ CQ CQ DE KB0FO KB0FO KB0FO KB0FO NN9O6 4319 M 94 SCV R 2294 B 48 AL TU 73 GL NN9O6 TEST,SWEEPSTAKES,qso,28,dx_expedition,52.4773125
3605,morse_003605.wav,IU3DM 599 1500,ARRLDX,exchange,23,clean,11.47975
2171,morse_002171.wav,CQ TEST CQ TEST DE DK1YD DK1YD K DK1YD 599 MD NC9M R 599 100 TU 73 GL NC9M TEST,ARRLDX,qso,19,contest_good,63.655375
352,morse_000352.wav,DN3FVV 3B ?,FIELD_DAY,partial,16,contest_good,11.058875
2721,morse_002721.wav,TEST JP9CQ JP9CQ TEST,IARU,cq,39,contest_moderate,8.5644375
4676,morse_004676.wav,JH9NG DAN NJ,NAQP,exchange,30,contest_poor,6.0565625
359,morse_000359.wav,AJ3WGK 599 ?,CQWW,partial,33,contest_good,6.645375
1292,morse_001292.wav,CQ CQ CQ DE JL6RQP JL6RQP JL6RQP,ARRLDX,cq,15,dx_expedition,34.7409375
2847,morse_002847.wav,VA4MMF 599 12,CQWW,exchange,19,contest_poor,11.8369375
2470,morse_002470.wav,CQ CQWPX CQ CQWPX DE F0QJ F0QJ K F0QJ F1ZTC 599 3815 TU 599 2025 F0QJ 73 GL F1ZTC TEST,CQWPX,qso,29,contest_good,51.4075
4861,morse_004861.wav,CQ NAQP CQ NAQP DE DF3KD DF3KD K DF3KD DE DM1WNM ANN TX K RON IL GL 73 GL DM1WNM TEST,NAQP,qso,38,contest_poor,32.35275
868,morse_000868.wav,CQ CQWPX CQ CQWPX DE DI1XI8 DI1XI8 K DI1XI8 JE9XJ 599 6T965 R 599 5679 TU TU QRZ? JE9XJ,CQWPX,qso,37,dx_expedition,38.461875
398,morse_000398.wav,CQ CQ CQ DE JC5K1 JC5K1 JC5K1 JC5K1 DA6MKS 599 74 TU 559 80 JC5K1 QSL TU TEST DA6MKS,IARU,qso,36,dx_expedition,37.058625
2680,morse_002680.wav,CQ TEST CQ TEST DE JH6CJ JH6CJ K,IARU,cq,34,contest_good,13.5235
3793,morse_003793.wav,CQ TEST CQ TEST DE M32YY M32YY K M32YY DE DQ3FEB 1A NFL K NR? NR? M32YY DE DQ3FEB 1A NFL K 3E ORG GL 73 GL DQ3FEB TEST,FIELD_DAY,qso,39,clean,44.8786875
3713,morse_003713.wav,TEST F4NST F4NST TEST F4NST EB1OIV 9661 DAVE MA R 926 JIM MI TU TU QRZ? EB1OIV,SPRINT,qso,36,contest_moderate,29.495875
4832,morse_004832.wav,F3ZR 4T265 B 23 MB,SWEEPSTAKES,exchange,26,dx_expedition,11.377875
2354,morse_002354.wav,CQ CQ CQ DE RN1NYZ RN1NYZ RN1NYZ RN1NYZ KT3WG 599 AZ TU 599 100 RN1NYZ 73 GL KT3WG TEST,ARRLDX,qso,40,contest_good,34.600125
3126,morse_003126.wav,G0LFV 599 ?,ARRLDX,partial,34,contest_poor,6.477625
1132,morse_001132.wav,DB3LQB 9T819 A 91 EPA,SWEEPSTAKES,exchange,38,contest_moderate,9.7705625
1237,morse_001237.wav,I6L6 6399 A 12 VT,SWEEPSTAKES,exchange,36,clean,8.3605625
1204,morse_001204.wav,CQ CQ CQ DE EH7JBW EH7JBW EH7JBW EH7JBW DK8XC 599 1500 TU 599 1500 EH7JBW 73 GL DK8XC TEST,ARRLDX,qso,32,dx_expedition,45.3085625
2388,morse_002388.wav,CQ TEST CQ TEST DE PQ6TKX PQ6TKX K,FIELD_DAY,cq,16,contest_moderate,28.8784375
4765,morse_004765.wav,K0D?,CQWW,partial,37,dx_expedition,2.5578125
3766,morse_003766.wav,TEST WS1BHO WS1BHO TEST WS1BHO DE WS6W 599 40 K 569 68 GL QSL TU TEST WS6W,IARU,qso,40,clean,27.01225
3164,morse_003164.wav,UH6Z1 6T009 A 93 EWA,SWEEPSTAKES,exchange,34,contest_moderate,10.26575
4131,morse_004131.wav,JN8FZ 599 KW,ARRLDX,exchange,17,clean,12.2614375
4222,morse_004222.wav,GI0XYD 1A ?,FIELD_DAY,partial,15,contest_moderate,12.6140625
2017,morse_002017.wav,CQ SWEEPSTAKES CQ SWEEPSTAKES DE DL5DEP DL5DEP K DL5DEP AY6RO 3T819 Q 48 MDC R 6287 A 35 VI TU TU QRZ? AY6RO,SWEEPSTAKES,qso,31,clean,49.1425625
2188,morse_002188.wav,CQ TEST CQ TEST DE IK2YK IK2YK K IK2YK DE F0MVL 599 6T905 K IK2YK AGN IK2YK DE F0MVL 599 6T905 K TU 599 1843 IK2YK 73 GL F0MVL TEST,CQWPX,qso,34,contest_poor,59.6685625
227,morse_000227.wav,CQ CQ CQ DE KM8Z KM8Z KM8Z,SWEEPSTAKES,cq,19,dx_expedition,22.37425
250,morse_000250.wav,DH9YQ 7054 BEN VA,SPRINT,exchange,39,dx_expedition,7.5010625
465,morse_000465.wav,CQ CQ CQ DE JM8UJC JM8UJC JM8UJC JM8UJC DE DF7NLH 599 29 K DF7N? DF7N? JM8UJC DE DF7NLH 599 29 K R 599 27 TU QSL TU TEST DF7NLH,CQWW,qso,24,contest_good,83.7973125
3858,morse_003858.wav,TEST VY0KY VY0KY TEST VY0KY 7097 JOE KY DB3RAR R 5721 LYNN VT TU 73 GL DB3RAR TEST,SPRINT,qso,20,contest_good,61.8666875
4524,morse_004524.wav,CQ TEST CQ TEST DE JD3JD JD3JD K JD3JD AD7GE 599 WI JD3JD AGN JD3JD AD7GE 599 WI 599 100 GL 73 GL AD7GE TEST,ARRLDX,qso,35,contest_poor,46.7065
409,morse_000409.wav,KG3O 8280 BOB AL,SPRINT,exchange,31,contest_poor,9.1268125
1500,morse_001500.wav,CQ CQ CQ DE JB3NJD JB3NJD JB3NJD,SPRINT,cq,16,contest_good,32.138875
2760,morse_002760.wav,CQ CQ CQ DE GJ0TSK GJ0TSK GJ0TSK GJ0TSK RV8LP 2A WV 1F NL GL TU QRZ? RV8LP,FIELD_DAY,qso,27,contest_good,43.153375
1967,morse_001967.wav,VY6XQ4 353 KATE WA,SPRINT,exchange,31,contest_poor,8.7694375
4589,morse_004589.wav,TEST EC7TQ EC7TQ TEST EC7TQ GM3RQ 579 31 R 599 8 TU TU QRZ? GM3RQ,CQWW,qso,31,dx_expedition,31.2505625
4602,morse_004602.wav,CQ TEST CQ TEST DE DE3XJN DE3XJN K DE3XJN 193 DAVE ND VK7ZX TU 8454 MARY NV DE3XJN QSL TU TEST VK7ZX,SPRINT,qso,29,contest_good,48.2681875
1662,morse_001662.wav,CQ CQ CQ DE DK2ZI DK2ZI DK2ZI DK2ZI DE JI5PK T178 B 30 IN K CALL? DK2ZI DE JI5PK T178 B 30 IN K R 5T946 A 25 SDG TU TU QRZ? JI5PK,SWEEPSTAKES,qso,34,clean,58.0914375
3573,morse_003573.wav,UA5F8 236 ?,SWEEPSTAKES,partial,38,dx_expedition,5.5136875
518,morse_000518.wav,CQ CQ CQ DE IK2XBW IK2XBW IK2XBW IK2XBW DE JL1SE1 PAT FL K R KEN NJ TU QSL TU TEST JL1SE1,NAQP,qso,38,clean,34.5066875
4358,morse_004358.wav,2E0IE 599 ?,CQWPX,partial,18,contest_moderate,10.468375
4796,morse_004796.wav,CQ CQ CQ DE JL3XA JL3XA JL3XA JL3XA DE DA3HMY 599 39 K TU 599 18 JL3XA QSL TU TEST DA3HMY,IARU,qso,37,contest_good,37.80175
4489,morse_004489.wav,ZW9GR 599 450,CQWPX,exchange,21,dx_expedition,11.5150625
212,morse_000212.wav,CQ TEST CQ TEST DE F1KR F1KR K,CQWPX,cq,30,clean,14.1273125
2815,morse_002815.wav,F4BW 599 ?,CQWW,partial,29,contest_moderate,6.491
706,morse_000706.wav,JS0XB 4438 B 77 EB,SWEEPSTAKES,exchange,23,contest_poor,13.187125
2599,morse_002599.wav,JG9?,FIELD_DAY,partial,16,clean,5.3255
3620,morse_003620.wav,CQ TEST CQ TEST DE GU9PDR GU9PDR K GU9PDR 599 9 M5RZ TU 599 28 GU9PDR QSL TU CQWW M5RZ,CQWW,qso,34,dx_expedition,38.4031875
458,morse_000458.wav,RB?,SPRINT,partial,34,contest_good,2.1601875
600,morse_000600.wav,IK6UF 599 ?,ARRLDX,partial,24,contest_moderate,8.2364375
3908,morse_003908.wav,F5YG 599 ?,CQWPX,partial,21,contest_moderate,8.7875625
4950,morse_004950.wav,LW6MP 599 23,CQWW,exchange,29,clean,7.74
1414,morse_001414.wav,CQ TEST CQ TEST DE DG0KR DG0KR K,SPRINT,cq,31,contest_poor,14.6520625
4220,morse_004220.wav,TEST KF8UA3 KF8UA3 TEST,IARU,cq,35,contest_good,8.85675
1902,morse_001902.wav,TEST AK4HR AK4HR TEST AK4HR 8449 A 76 WCF IU9XIV 9786 B 73 WCF GL TU QRZ? IU9XIV,SWEEPSTAKES,qso,22,contest_moderate,53.6793125
1006,morse_001006.wav,JM6WW RON TX,NAQP,exchange,18,contest_poor,9.8009375
3901,morse_003901.wav,IZ9?,ARRLDX,partial,35,contest_good,2.4263125
3837,morse_003837.wav,CQ TEST CQ TEST DE EC5NBE EC5NBE K,IARU,cq,36,contest_good,12.0788125
4046,morse_004046.wav,CQ CQ CQ DE WR7I WR7I WR7I WR7I DE WY3VFE 599 11 K TU 599 35 WR7I 73 GL WY3VFE TEST,IARU,qso,31,contest_moderate,40.879
3603,morse_003603.wav,JC4XF 599 ?,IARU,partial,30,dx_expedition,7.212125
3151,morse_003151.wav,VA7MET 8299 S 78 IL,SWEEPSTAKES,exchange,32,clean,9.53
679,morse_000679.wav,CQ TEST CQ TEST DE NO7O NO7O K,NAQP,cq,39,contest_poor,10.8909375
2100,morse_002100.wav,DK4T9 599 ?,CQWPX,partial,22,contest_poor,9.0564375
3317,morse_003317.wav,CQ TEST CQ TEST DE AY0HM AY0HM K AY0HM PQ3YJ 2B NC CALL? AY0HM PQ3YJ 2B NC 2A ON GL TU QRZ? PQ3YJ,FIELD_DAY,qso,38,contest_good,40.3183125
763,morse_000763.wav,CQ CQ CQ DE IZ4MJ IZ4MJ IZ4MJ,ARRLDX,cq,19,dx_expedition,23.766125
4405,morse_004405.wav,CQ CQ CQ DE LS6ZP LS6ZP LS6ZP LS6ZP DR7SCQ 599 44 TU 599 7 LS6ZP 73 GL DR7SCQ TEST,IARU,qso,35,contest_moderate,36.5703125
873,morse_000873.wav,JO5?,CQWW,partial,16,contest_poor,5.0004375
3582,morse_003582.wav,WK?,SPRINT,partial,18,contest_good,3.00925
831,morse_000831.wav,NJ0TA 599 1,CQWW,exchange,30,clean,7.0635625
3918,morse_003918.wav,CQ TEST CQ TEST DE IU8TO IU8TO K,ARRLDX,cq,35,contest_good,12.3740625
339,morse_000339.wav,IZ8OUZ T519 SAM SC,SPRINT,exchange,31,contest_poor,9.21675
1945,morse_001945.wav,CQ TEST CQ TEST DE EG9KN EG9KN K,SWEEPSTAKES,cq,38,contest_poor,11.1449375
478,morse_000478.wav,CQ CQ CQ DE JK3Z9 JK3Z9 JK3Z9 JK3Z9 599 MT NW9M TU 569 100 JK3Z9 73 GL NW9M TEST,ARRLDX,qso,25,contest_poor,53.88025
207,morse_000207.wav,TEST JC8BQ JC8BQ TEST JC8BQ DE GI4B8 1316 A 82 UT K TU 5204 B 56 WTX JC8BQ 73 GL GI4B8 TEST,SWEEPSTAKES,qso,20,dx_expedition,69.8633125
29,morse_000029.wav,CQ CQ CQ DE AY9RHB AY9RHB AY9RHB,IARU,cq,29,contest_poor,17.8488125
1451,morse_001451.wav,JR3SU 3F WWA,FIELD_DAY,exchange,24,dx_expedition,7.65275
4671,morse_004671.wav,EF6FQ 599 ?,CQWW,partial,34,contest_poor,5.93925
3808,morse_003808.wav,CQ NAQP CQ NAQP DE JS4ZUL JS4ZUL K JS4ZUL SAM GA AD3U R KATE VT TU TU QRZ? AD3U,NAQP,qso,15,contest_good,75.0100625
47,morse_000047.wav,CQ CQ CQ DE LO0R1 LO0R1 LO0R1 LO0R1 DE DG6XVU 599 27 K TU 599 31 LO0R1 TU QRZ? DG6XVU,CQWW,qso,26,dx_expedition,55.541875
3547,morse_003547.wav,TEST AB1UA AB1UA TEST AB1UA AZ3ZVB 599 39 599 55 GL QSL TU TEST AZ3ZVB,IARU,qso,26,clean,38.7444375
4932,morse_004932.wav,F4?,CQWW,partial,35,contest_good,1.893125
1400,morse_001400.wav,TEST F4ORI F4ORI TEST,SWEEPSTAKES,cq,32,dx_expedition,8.0685
3038,morse_003038.wav,VO7QUG 2484 B 92 ENY,SWEEPSTAKES,exchange,21,contest_poor,16.4043125
441,morse_000441.wav,TEST EC9WN2 EC9WN2 TEST,ARRLDX,cq,16,clean,18.4588125
2510,morse_002510.wav,GW3SJ 599 39,IARU,exchange,28,dx_expedition,8.0340625
2428,morse_002428.wav,CQ CQ CQ DE VK7XQY VK7XQY VK7XQY VK7XQY DE JN5KY FRED IL K JN5? JN5? VK7XQY DE JN5KY FRED IL K AL SD GL TU QRZ? JN5KY,NAQP,qso,17,dx_expedition,105.73
3717,morse_003717.wav,CQ CQ CQ DE RP4KQO RP4KQO RP4KQO RP4KQO DE EE2TAB 8T151 SUE MS K 772 RAY MI GL 73 GL EE2TAB TEST,SPRINT,qso,23,contest_good,61.4759375
1970,morse_001970.wav,CQ TEST CQ TEST DE RW2KP2 RW2KP2 K,CQWW,cq,34,contest_good,14.5833125
2195,morse_002195.wav,CQ CQ CQ DE GM7BEQ GM7BEQ GM7BEQ,ARRLDX,cq,28,contest_good,17.36875
1195,morse_001195.wav,DJ1EO 559 KW,ARRLDX,exchange,24,contest_moderate,8.4643125
1367,morse_001367.wav,TEST WT3L WT3L TEST WT3L DE VO7FOD 599 KW K 599 ND GL TU QRZ? VO7FOD,ARRLDX,qso,24,contest_good,41.4111875
1761,morse_001761.wav,TEST I5BY I5BY TEST I5BY 5A RI DL9WF 2D SCV GL TU QRZ? DL9WF,FIELD_DAY,qso,39,contest_moderate,21.7045
3726,morse_003726.wav,CQ CQ CQ DE IW9XQ IW9XQ IW9XQ,SPRINT,cq,37,contest_good,13.0723125
1015,morse_001015.wav,CQ TEST CQ TEST DE IQ5M0 IQ5M0 K,NAQP,cq,16,contest_poor,27.7520625
4350,morse_004350.wav,CQ CQ CQ DE GD0WHE GD0WHE GD0WHE,CQWW,cq,18,clean,26.746375
2632,morse_002632.wav,CQ CQ CQ DE GW7XWH GW7XWH GW7XWH,NAQP,cq,15,contest_moderate,33.4079375
4120,morse_004120.wav,CQ CQ CQ DE JA0TMJ JA0TMJ JA0TMJ JA0TMJ DE JA2YD 599 7 K JA0TMJ AGN JA0TMJ DE JA2YD 599 7 K 599 34 GL QSL TU TEST JA2YD,CQWW,qso,40,clean,47.143
3359,morse_003359.wav,CQ CQ CQ DE VK2CRJF VK2CRJF VK2CRJF,IARU,cq,16,dx_expedition,35.080375
2111,morse_002111.wav,CQ TEST CQ TEST DE VY1LSC VY1LSC K VY1LSC DE M4QC 1B AZ K CALL? VY1LSC DE M4QC 1B AZ K R 2A WTX TU TU QRZ? M4QC,FIELD_DAY,qso,33,dx_expedition,50.4336875
2538,morse_002538.wav,DN4LI 4A WV,FIELD_DAY,exchange,37,contest_moderate,4.3223125
4922,morse_004922.wav,F2WF 599 KW,ARRLDX,exchange,34,clean,5.8364375
2247,morse_002247.wav,WV?,CQWW,partial,38,contest_poor,1.81625
1912,morse_001912.wav,IW4VU8 7B CT,FIELD_DAY,exchange,21,contest_moderate,8.85125
678,morse_000678.wav,CQ CQ CQ DE LO7CMU LO7CMU LO7CMU,CQWPX,cq,20,contest_good,25.472625
3593,morse_003593.wav,TEST NE5V0 NE5V0 TEST,FIELD_DAY,cq,34,dx_expedition,7.824375
3338,morse_003338.wav,VK5NFSC 9846 ?,SWEEPSTAKES,partial,30,contest_good,8.1050625
3102,morse_003102.wav,GD9AW?,ARRLDX,partial,20,contest_moderate,5.414
4641,morse_004641.wav,CQ CQ CQ DE I9NQ I9NQ I9NQ I9NQ DD5X5 7A NE R 3B IL TU 73 GL DD5X5 TEST,FIELD_DAY,qso,37,contest_moderate,28.130125
1942,morse_001942.wav,G1V?,CQWW,partial,17,contest_poor,4.7945625
1747,morse_001747.wav,CQ TEST CQ TEST DE IU6NMJ IU6NMJ K IU6NMJ M34GUN 599 11 R 599 28 TU 73 GL M34GUN TEST,IARU,qso,17,clean,71.78775
4574,morse_004574.wav,CQ CQ CQ DE JQ9AJK JQ9AJK JQ9AJK,NAQP,cq,16,contest_good,34.384875
2163,morse_002163.wav,PR6VX?,CQWPX,partial,36,contest_moderate,3.1745
1713,morse_001713.wav,CQ TEST CQ TEST DE IW4KNM IW4KNM K,CQWPX,cq,33,clean,13.5380625
429,morse_000429.wav,EA2FFY 579 ?,CQWPX,partial,39,dx_expedition,5.4130625
30,morse_000030.wav,CQ FIELD_DAY CQ FIELD_DAY DE JP6CGQ JP6CGQ K JP6CGQ WC3SJ 6A NNY 3A WWA GL 73 GL WC3SJ TEST,FIELD_DAY,qso,30,contest_moderate,44.3605625
4549,morse_004549.wav,G0XA GARY ?,NAQP,partial,27,contest_good,7.168125
797,morse_000797.wav,DE3V?,NAQP,partial,33,contest_moderate,2.527
2718,morse_002718.wav,CQ CQ CQ DE M38UCN M38UCN M38UCN M38UCN 599 NM AI6AEF 599 KW GL TU QRZ? AI6AEF,ARRLDX,qso,17,contest_moderate,69.365875
2906,morse_002906.wav,VA0NX 599 13,CQWW,exchange,19,contest_moderate,11.896375
456,morse_000456.wav,RF0SA 137 FRANK RI,SPRINT,exchange,16,dx_expedition,16.7231875
2754,morse_002754.wav,IK6B4 599 ?,ARRLDX,partial,16,contest_moderate,11.979625
1664,morse_001664.wav,GD8CD 599 5244,CQWPX,exchange,25,contest_poor,10.1470625
1466,morse_001466.wav,JF1KEP 599 ?,ARRLDX,partial,30,dx_expedition,7.5155
2361,morse_002361.wav,CQ TEST CQ TEST DE IZ0EZ IZ0EZ K IZ0EZ AC0EP KATE MD R SUE NV TU 73 GL AC0EP TEST,NAQP,qso,21,contest_poor,52.0106875
2301,morse_002301.wav,TEST EB7ZI2 EB7ZI2 TEST EB7ZI2 DE KF3IU 3542 A 57 UT K R 1304 B 26 EB TU TU QRZ? KF3IU,SWEEPSTAKES,qso,39,contest_moderate,31.63675
356,morse_000356.wav,NC0N 4A DE,FIELD_DAY,exchange,24,contest_good,6.12325
542,morse_000542.wav,EA3OML 599 5,ARRLDX,exchange,27,clean,7.3495
2566,morse_002566.wav,EA7?,CQWW,partial,20,contest_good,3.1383125
3758,morse_003758.wav,JP4R2 599 ?,CQWW,partial,20,clean,10.841625
1725,morse_001725.wav,DF8TWC MIKE NC,NAQP,exchange,32,dx_expedition,6.3750625
3542,morse_003542.wav,JA4KNI 599 15,CQWW,exchange,20,contest_good,10.8364375
4129,morse_004129.wav,CQ CQ CQ DE KV7MF KV7MF KV7MF KV7MF JM1GPH 599 12 R 599 10 TU TU QRZ? JM1GPH,CQWW,qso,25,contest_poor,50.2741875
70,morse_000070.wav,CQ CQ CQ DE RM0YF RM0YF RM0YF RM0YF F2KSS LEE ID R TOM CO TU TU QRZ? F2KSS,NAQP,qso,27,clean,41.674875
2846,morse_002846.wav,TEST VK7WIMN VK7WIMN TEST VK7WIMN F6QKA 1433 A 62 MO R 9878 B 82 LA TU QSL TU TEST F6QKA,SWEEPSTAKES,qso,40,dx_expedition,31.4348125
2885,morse_002885.wav,CQ CQ CQ DE DF8UEX DF8UEX DF8UEX DF8UEX DE LW8KI8 599 31 K 589 24 GL TU QRZ? LW8KI8,CQWW,qso,17,clean,76.2848125
570,morse_000570.wav,IK7NM 599 3902,CQWPX,exchange,16,clean,15.9139375
2267,morse_002267.wav,VK4LI 599 16,IARU,exchange,20,contest_moderate,10.25275
2605,morse_002605.wav,LT?,ARRLDX,partial,16,clean,2.9895
524,morse_000524.wav,CQ TEST CQ TEST DE WY6CBB WY6CBB K WY6CBB VK5DQCK 9T311 A 18 MB TU 774 B 08 OH WY6CBB 73 GL VK5DQCK TEST,SWEEPSTAKES,qso,30,contest_good,53.012375
4569,morse_004569.wav,CQ CQ CQ DE DO4IJN DO4IJN DO4IJN DO4IJN F5AR 913 LARRY NC QRZ? DE DO4IJN DO4IJN F5AR 913 LARRY NC 4T208 RAY MS GL QSL TU SPRINT F5AR,SPRINT,qso,24,contest_good,80.782125
485,morse_000485.wav,RH1CK AL VA,NAQP,exchange,15,clean,11.0826875
623,morse_000623.wav,VK1LTKO 569 ?,ARRLDX,partial,25,contest_poor,8.971875
1368,morse_001368.wav,DF7AR 4F ?,FIELD_DAY,partial,28,contest_poor,5.78125
2058,morse_002058.wav,CQ CQ CQ DE DB9EA8 DB9EA8 DB9EA8 DB9EA8 M30JAV 599 9T356 TU 599 1895 DB9EA8 QSL TU CQWPX M30JAV,CQWPX,qso,19,clean,80.1520625
3137,morse_003137.wav,TEST JB0YXS JB0YXS TEST JB0YXS DE IW5ZGZ PAT FL K LYNN RI GL 73 GL IW5ZGZ TEST,NAQP,qso,39,contest_moderate,28.840375
1457,morse_001457.wav,AE8F 9023 CHUCK HI,SPRINT,exchange,16,clean,18.071375
2187,morse_002187.wav,CQ TEST CQ TEST DE WZ7N WZ7N K,SPRINT,cq,28,dx_expedition,14.615625
2071,morse_002071.wav,CQ CQ CQ DE JO7VXQ JO7VXQ JO7VXQ JO7VXQ WL5O 599 NJ TU 599 1500 JO7VXQ TU QRZ? WL5O,ARRLDX,qso,18,clean,78.6766875
526,morse_000526.wav,CQ TEST CQ TEST DE VE3MI VE3MI K,FIELD_DAY,cq,31,contest_moderate,13.037125
979,morse_000979.wav,TEST NN0J NN0J TEST,IARU,cq,35,contest_good,7.27025
4191,morse_004191.wav,TEST F1EML F1EML TEST F1EML DE GJ6YA 599 9516 K 599 5264 GL 73 GL GJ6YA TEST,CQWPX,qso,20,contest_good,56.376875
3867,morse_003867.wav,UD2EU7 599 ?,IARU,partial,28,contest_good,7.4725625
2621,morse_002621.wav,IW6OH 4A VT,FIELD_DAY,exchange,34,contest_good,4.934125
3191,morse_003191.wav,F9YV GEORGE ?,NAQP,partial,38,contest_moderate,5.748125
640,morse_000640.wav,CQ CQ CQ DE EG1YPH EG1YPH EG1YPH,SWEEPSTAKES,cq,29,clean,17.569
2375,morse_002375.wav,TEST DE6JSS DE6JSS TEST DE6JSS CHUCK NM JQ0FMK CALL? DE6JSS CHUCK NM JQ0FMK LEE OH GL QSL TU TEST JQ0FMK,NAQP,qso,21,contest_good,67.6423125
3355,morse_003355.wav,TEST DO8AR DO8AR TEST DO8AR DE WG4YKQ 599 3299 K R 599 4T225 TU 73 GL WG4YKQ TEST,CQWPX,qso,20,dx_expedition,60.617
948,morse_000948.wav,VA2GC 599 15,CQWW,exchange,23,contest_moderate,9.627875
2476,morse_002476.wav,IQ7PA 599 ?,CQWW,partial,15,contest_moderate,13.2184375
4964,morse_004964.wav,DN7W8 LEE ?,NAQP,partial,23,clean,7.1649375
3951,morse_003951.wav,TEST VA2DWP VA2DWP TEST VA2DWP WT9X2 599 CA 599 KW GL QSL TU TEST WT9X2,ARRLDX,qso,32,contest_moderate,32.7151875
2604,morse_002604.wav,CQ TEST CQ TEST DE UE8MF UE8MF K,SWEEPSTAKES,cq,27,contest_good,15.32725
4208,morse_004208.wav,VK6PPB 599 KW,ARRLDX,exchange,26,contest_moderate,8.5786875
3944,morse_003944.wav,EG7YXK 3F SB,FIELD_DAY,exchange,31,contest_poor,6.289125
3850,morse_003850.wav,KI0WH?,CQWPX,partial,28,dx_expedition,3.8984375
1302,morse_001302.wav,CQ CQ CQ DE VE3YH VE3YH VE3YH,SPRINT,cq,36,contest_good,12.6859375
490,morse_000490.wav,CQ TEST CQ TEST DE WV7JVI WV7JVI K,SWEEPSTAKES,cq,40,contest_good,12.1551875
58,morse_000058.wav,F8GS 7455 ?,SWEEPSTAKES,partial,27,contest_good,6.96975
1609,morse_001609.wav,VO9AV 599 20,CQWW,exchange,23,contest_moderate,9.970125
3695,morse_003695.wav,DQ0DKJ 599 ?,CQWW,partial,16,dx_expedition,14.0811875
2482,morse_002482.wav,IK?,FIELD_DAY,partial,21,clean,2.4581875
2659,morse_002659.wav,TEST VE5JC VE5JC TEST,SWEEPSTAKES,cq,27,contest_good,9.3275625
1244,morse_001244.wav,WV3K?,SPRINT,partial,28,contest_moderate,3.3809375
3899,morse_003899.wav,CQ TEST CQ TEST DE GM0REL GM0REL K,ARRLDX,cq,32,contest_moderate,14.4165
